{"code_sha256": "791d73995674b8a79f6f4b1d0ff924b8f1e344f0ebf55ac9ed65671b904844f7", "config_sha256": "144d4162c7f9b0a712f5f041c66aa66ba14b7757da5f7d0258b543ed35b1eda9", "decision": "keep", "description": "Majority-class baseline with bootstrap seed 0.", "environment": "Python 3.12.12 on macOS-15.7.4-arm64-arm-64bit", "evaluator_immutable": true, "experiment_spec_sha256": "0b162136a2ee4e8c192c5b4027ee823124a3df7040aa17aee5c6bf2cfd5dae7e", "metric": 0.3381535038932147, "metric_definition": "primary_metric (maximize)", "metrics_path": "runs/baseline-majority-seed0/metrics.json", "protocol_fingerprint": "5662940a63836a421cf86ecdf3fcb3719d48ffe2853252afbc1ef640e486a845", "raw_outputs": ["runs/baseline-majority-seed0/metrics.json", "runs/baseline-majority-seed0/predictions.jsonl", "runs/baseline-majority-seed0/stderr.txt", "runs/baseline-majority-seed0/stdout.txt"], "reason": "improved primary metric", "run_id": "baseline-majority-seed0", "status": "ok", "trial_id": "baseline-majority-seed0"}
{"code_sha256": "791d73995674b8a79f6f4b1d0ff924b8f1e344f0ebf55ac9ed65671b904844f7", "config_sha256": "bdb2e6270d2aff37a54ecda39a79e361641b36b903228930e111c58ccae84d40", "decision": "keep", "description": "Message-length heuristic with bootstrap seed 1.", "environment": "Python 3.12.12 on macOS-15.7.4-arm64-arm-64bit", "evaluator_immutable": true, "experiment_spec_sha256": "0b162136a2ee4e8c192c5b4027ee823124a3df7040aa17aee5c6bf2cfd5dae7e", "metric": 0.42281550405704854, "metric_definition": "primary_metric (maximize)", "metrics_path": "runs/baseline-length-seed1/metrics.json", "protocol_fingerprint": "5662940a63836a421cf86ecdf3fcb3719d48ffe2853252afbc1ef640e486a845", "raw_outputs": ["runs/baseline-length-seed1/metrics.json", "runs/baseline-length-seed1/predictions.jsonl", "runs/baseline-length-seed1/stderr.txt", "runs/baseline-length-seed1/stdout.txt"], "reason": "improved primary metric", "run_id": "baseline-length-seed1", "status": "ok", "trial_id": "baseline-length-seed1"}
{"code_sha256": "791d73995674b8a79f6f4b1d0ff924b8f1e344f0ebf55ac9ed65671b904844f7", "config_sha256": "eb4d71f26fa3fc8513b77ee5b2c230f61a1f2dfdf761b85aeea21f419543b595", "decision": "keep", "description": "Fixed sentiment lexicon with bootstrap seed 2.", "environment": "Python 3.12.12 on macOS-15.7.4-arm64-arm-64bit", "evaluator_immutable": true, "experiment_spec_sha256": "0b162136a2ee4e8c192c5b4027ee823124a3df7040aa17aee5c6bf2cfd5dae7e", "metric": 0.4807446118530743, "metric_definition": "primary_metric (maximize)", "metrics_path": "runs/baseline-lexicon-seed2/metrics.json", "protocol_fingerprint": "5662940a63836a421cf86ecdf3fcb3719d48ffe2853252afbc1ef640e486a845", "raw_outputs": ["runs/baseline-lexicon-seed2/metrics.json", "runs/baseline-lexicon-seed2/predictions.jsonl", "runs/baseline-lexicon-seed2/stderr.txt", "runs/baseline-lexicon-seed2/stdout.txt"], "reason": "improved primary metric", "run_id": "baseline-lexicon-seed2", "status": "ok", "trial_id": "baseline-lexicon-seed2"}
{"code_sha256": "791d73995674b8a79f6f4b1d0ff924b8f1e344f0ebf55ac9ed65671b904844f7", "config_sha256": "205a119c1405315ff14ccdec66ec44fa7c0fac629740ad3df22e7b365a9b4a5e", "decision": "keep", "description": "Laplace-smoothed unigram Naive Bayes with bootstrap seed 3.", "environment": "Python 3.12.12 on macOS-15.7.4-arm64-arm-64bit", "evaluator_immutable": true, "experiment_spec_sha256": "0b162136a2ee4e8c192c5b4027ee823124a3df7040aa17aee5c6bf2cfd5dae7e", "metric": 0.8335965241857798, "metric_definition": "primary_metric (maximize)", "metrics_path": "runs/baseline-unigram-seed3/metrics.json", "protocol_fingerprint": "5662940a63836a421cf86ecdf3fcb3719d48ffe2853252afbc1ef640e486a845", "raw_outputs": ["runs/baseline-unigram-seed3/metrics.json", "runs/baseline-unigram-seed3/predictions.jsonl", "runs/baseline-unigram-seed3/stderr.txt", "runs/baseline-unigram-seed3/stdout.txt"], "reason": "improved primary metric", "run_id": "baseline-unigram-seed3", "status": "ok", "trial_id": "baseline-unigram-seed3"}
{"code_sha256": "791d73995674b8a79f6f4b1d0ff924b8f1e344f0ebf55ac9ed65671b904844f7", "config_sha256": "83719d3c37b4f569d460ddb388210b0442ad718888014b2044d01b101b899455", "decision": "keep", "description": "Unigram smoothing ablation.", "environment": "Python 3.12.12 on macOS-15.7.4-arm64-arm-64bit", "evaluator_immutable": true, "experiment_spec_sha256": "0b162136a2ee4e8c192c5b4027ee823124a3df7040aa17aee5c6bf2cfd5dae7e", "metric": 0.8403343304493236, "metric_definition": "primary_metric (maximize)", "metrics_path": "runs/ablation-unigram-alpha05-seed1/metrics.json", "protocol_fingerprint": "5662940a63836a421cf86ecdf3fcb3719d48ffe2853252afbc1ef640e486a845", "raw_outputs": ["runs/ablation-unigram-alpha05-seed1/metrics.json", "runs/ablation-unigram-alpha05-seed1/predictions.jsonl", "runs/ablation-unigram-alpha05-seed1/stderr.txt", "runs/ablation-unigram-alpha05-seed1/stdout.txt"], "reason": "improved primary metric", "run_id": "ablation-unigram-alpha05-seed1", "status": "ok", "trial_id": "ablation-unigram-alpha05-seed1"}
{"code_sha256": "791d73995674b8a79f6f4b1d0ff924b8f1e344f0ebf55ac9ed65671b904844f7", "config_sha256": "53fae62a27b51127527856893a62f267384d702d766fa9405ba81cebfda14b98", "decision": "discard", "description": "Unigram vocabulary-frequency ablation.", "environment": "Python 3.12.12 on macOS-15.7.4-arm64-arm-64bit", "evaluator_immutable": true, "experiment_spec_sha256": "0b162136a2ee4e8c192c5b4027ee823124a3df7040aa17aee5c6bf2cfd5dae7e", "metric": 0.8268594562677809, "metric_definition": "primary_metric (maximize)", "metrics_path": "runs/ablation-unigram-minfreq2-seed2/metrics.json", "protocol_fingerprint": "5662940a63836a421cf86ecdf3fcb3719d48ffe2853252afbc1ef640e486a845", "raw_outputs": ["runs/ablation-unigram-minfreq2-seed2/metrics.json", "runs/ablation-unigram-minfreq2-seed2/predictions.jsonl", "runs/ablation-unigram-minfreq2-seed2/stderr.txt", "runs/ablation-unigram-minfreq2-seed2/stdout.txt"], "reason": "did not improve primary metric", "run_id": "ablation-unigram-minfreq2-seed2", "status": "ok", "trial_id": "ablation-unigram-minfreq2-seed2"}
{"code_sha256": "791d73995674b8a79f6f4b1d0ff924b8f1e344f0ebf55ac9ed65671b904844f7", "config_sha256": "93c2cd413594d30464db9df201e67136ae9bd2076749e2448fe6866aff219d47", "decision": "discard", "description": "Add adjacent-token bigrams.", "environment": "Python 3.12.12 on macOS-15.7.4-arm64-arm-64bit", "evaluator_immutable": true, "experiment_spec_sha256": "0b162136a2ee4e8c192c5b4027ee823124a3df7040aa17aee5c6bf2cfd5dae7e", "metric": 0.8285593220338983, "metric_definition": "primary_metric (maximize)", "metrics_path": "runs/ablation-bigram-seed3/metrics.json", "protocol_fingerprint": "5662940a63836a421cf86ecdf3fcb3719d48ffe2853252afbc1ef640e486a845", "raw_outputs": ["runs/ablation-bigram-seed3/metrics.json", "runs/ablation-bigram-seed3/predictions.jsonl", "runs/ablation-bigram-seed3/stderr.txt", "runs/ablation-bigram-seed3/stdout.txt"], "reason": "did not improve primary metric", "run_id": "ablation-bigram-seed3", "status": "ok", "trial_id": "ablation-bigram-seed3"}
{"code_sha256": "791d73995674b8a79f6f4b1d0ff924b8f1e344f0ebf55ac9ed65671b904844f7", "config_sha256": "9eea8817767b94f9a965cb4de90b9ed9ff5d130af6e48da485cfc2763960a5bf", "decision": "discard", "description": "Bigram frequency-filter ablation.", "environment": "Python 3.12.12 on macOS-15.7.4-arm64-arm-64bit", "evaluator_immutable": true, "experiment_spec_sha256": "0b162136a2ee4e8c192c5b4027ee823124a3df7040aa17aee5c6bf2cfd5dae7e", "metric": 0.8285709443427565, "metric_definition": "primary_metric (maximize)", "metrics_path": "runs/ablation-bigram-minfreq2-seed4/metrics.json", "protocol_fingerprint": "5662940a63836a421cf86ecdf3fcb3719d48ffe2853252afbc1ef640e486a845", "raw_outputs": ["runs/ablation-bigram-minfreq2-seed4/metrics.json", "runs/ablation-bigram-minfreq2-seed4/predictions.jsonl", "runs/ablation-bigram-minfreq2-seed4/stderr.txt", "runs/ablation-bigram-minfreq2-seed4/stdout.txt"], "reason": "did not improve primary metric", "run_id": "ablation-bigram-minfreq2-seed4", "status": "ok", "trial_id": "ablation-bigram-minfreq2-seed4"}
