{"code_sha256": "a8054ee557567eec47692f11b900eec6c153295f97cd6a5462458d01d4157d8c", "config_sha256": "26cd2537e5c1418357f2d1ecca13ff079b5d3f71ae88f0573fca89e2d8391444", "decision": "keep", "description": "No secondary indexes, seed 0.", "environment": "Python 3.12.12 on macOS-15.7.4-arm64-arm-64bit", "evaluator_immutable": true, "experiment_spec_sha256": "284f2178f4fc5613e248b18006add3f06b0c242c14ddd93db9e398f147cff425", "metric": 46.5152229, "metric_definition": "primary_metric (minimize)", "metrics_path": "runs/baseline-seed0/metrics.json", "protocol_fingerprint": "433b63f8c55c6e043dfe49f12d893c09b28cbb110bbb3a411ce434fdc338e1e2", "raw_outputs": ["runs/baseline-seed0/metrics.json", "runs/baseline-seed0/stdout.txt", "runs/baseline-seed0/stderr.txt"], "reason": "improved primary metric", "run_id": "baseline-seed0", "status": "ok", "trial_id": "baseline-seed0"}
{"code_sha256": "a8054ee557567eec47692f11b900eec6c153295f97cd6a5462458d01d4157d8c", "config_sha256": "6086152f279ab165f22644f1aad6d1b154f173d8cf93d721aefc251de3385dc7", "decision": "keep", "description": "No secondary indexes, seed 1.", "environment": "Python 3.12.12 on macOS-15.7.4-arm64-arm-64bit", "evaluator_immutable": true, "experiment_spec_sha256": "284f2178f4fc5613e248b18006add3f06b0c242c14ddd93db9e398f147cff425", "metric": 38.69099614999999, "metric_definition": "primary_metric (minimize)", "metrics_path": "runs/baseline-seed1/metrics.json", "protocol_fingerprint": "433b63f8c55c6e043dfe49f12d893c09b28cbb110bbb3a411ce434fdc338e1e2", "raw_outputs": ["runs/baseline-seed1/metrics.json", "runs/baseline-seed1/stdout.txt", "runs/baseline-seed1/stderr.txt"], "reason": "improved primary metric", "run_id": "baseline-seed1", "status": "ok", "trial_id": "baseline-seed1"}
{"code_sha256": "a8054ee557567eec47692f11b900eec6c153295f97cd6a5462458d01d4157d8c", "config_sha256": "c29eae2e93d3ea6e3027762a4516692b9ed07b6b5d2b8f03c240cd610ba5cabe", "decision": "discard", "description": "No secondary indexes, seed 2.", "environment": "Python 3.12.12 on macOS-15.7.4-arm64-arm-64bit", "evaluator_immutable": true, "experiment_spec_sha256": "284f2178f4fc5613e248b18006add3f06b0c242c14ddd93db9e398f147cff425", "metric": 45.3883545, "metric_definition": "primary_metric (minimize)", "metrics_path": "runs/baseline-seed2/metrics.json", "protocol_fingerprint": "433b63f8c55c6e043dfe49f12d893c09b28cbb110bbb3a411ce434fdc338e1e2", "raw_outputs": ["runs/baseline-seed2/metrics.json", "runs/baseline-seed2/stdout.txt", "runs/baseline-seed2/stderr.txt"], "reason": "did not improve primary metric", "run_id": "baseline-seed2", "status": "ok", "trial_id": "baseline-seed2"}
{"code_sha256": "a8054ee557567eec47692f11b900eec6c153295f97cd6a5462458d01d4157d8c", "config_sha256": "069a148c7c6dd6d250255cf00889da8f342b46b5ece2e95bb1b07880e2537907", "decision": "discard", "description": "No secondary indexes, seed 3.", "environment": "Python 3.12.12 on macOS-15.7.4-arm64-arm-64bit", "evaluator_immutable": true, "experiment_spec_sha256": "284f2178f4fc5613e248b18006add3f06b0c242c14ddd93db9e398f147cff425", "metric": 53.22321424999999, "metric_definition": "primary_metric (minimize)", "metrics_path": "runs/baseline-seed3/metrics.json", "protocol_fingerprint": "433b63f8c55c6e043dfe49f12d893c09b28cbb110bbb3a411ce434fdc338e1e2", "raw_outputs": ["runs/baseline-seed3/metrics.json", "runs/baseline-seed3/stdout.txt", "runs/baseline-seed3/stderr.txt"], "reason": "did not improve primary metric", "run_id": "baseline-seed3", "status": "ok", "trial_id": "baseline-seed3"}
{"code_sha256": "a8054ee557567eec47692f11b900eec6c153295f97cd6a5462458d01d4157d8c", "config_sha256": "4c6da886cef732faf41c5bc8139d9e0d4ce331805b764131e4f739235428bcb8", "decision": "discard", "description": "Add only an hour index.", "environment": "Python 3.12.12 on macOS-15.7.4-arm64-arm-64bit", "evaluator_immutable": true, "experiment_spec_sha256": "284f2178f4fc5613e248b18006add3f06b0c242c14ddd93db9e398f147cff425", "metric": 42.04770625, "metric_definition": "primary_metric (minimize)", "metrics_path": "runs/ablation-hour-index-seed1/metrics.json", "protocol_fingerprint": "433b63f8c55c6e043dfe49f12d893c09b28cbb110bbb3a411ce434fdc338e1e2", "raw_outputs": ["runs/ablation-hour-index-seed1/metrics.json", "runs/ablation-hour-index-seed1/stdout.txt", "runs/ablation-hour-index-seed1/stderr.txt"], "reason": "did not improve primary metric", "run_id": "ablation-hour-index-seed1", "status": "ok", "trial_id": "ablation-hour-index-seed1"}
{"code_sha256": "a8054ee557567eec47692f11b900eec6c153295f97cd6a5462458d01d4157d8c", "config_sha256": "ebba4aea6a3ae13176acd26a351ef44b2fa7d2e5003bada428e1af706ba40ec8", "decision": "discard", "description": "Add only a weather and working-day index.", "environment": "Python 3.12.12 on macOS-15.7.4-arm64-arm-64bit", "evaluator_immutable": true, "experiment_spec_sha256": "284f2178f4fc5613e248b18006add3f06b0c242c14ddd93db9e398f147cff425", "metric": 49.67862115, "metric_definition": "primary_metric (minimize)", "metrics_path": "runs/ablation-weather-index-seed2/metrics.json", "protocol_fingerprint": "433b63f8c55c6e043dfe49f12d893c09b28cbb110bbb3a411ce434fdc338e1e2", "raw_outputs": ["runs/ablation-weather-index-seed2/metrics.json", "runs/ablation-weather-index-seed2/stdout.txt", "runs/ablation-weather-index-seed2/stderr.txt"], "reason": "did not improve primary metric", "run_id": "ablation-weather-index-seed2", "status": "ok", "trial_id": "ablation-weather-index-seed2"}
{"code_sha256": "a8054ee557567eec47692f11b900eec6c153295f97cd6a5462458d01d4157d8c", "config_sha256": "8d16b66af8f6004ed89affa25608a782fc3899ad7edba45a18e00a634a6bc1f6", "decision": "keep", "description": "Add only a season and year index.", "environment": "Python 3.12.12 on macOS-15.7.4-arm64-arm-64bit", "evaluator_immutable": true, "experiment_spec_sha256": "284f2178f4fc5613e248b18006add3f06b0c242c14ddd93db9e398f147cff425", "metric": 32.412629149999994, "metric_definition": "primary_metric (minimize)", "metrics_path": "runs/ablation-season-index-seed3/metrics.json", "protocol_fingerprint": "433b63f8c55c6e043dfe49f12d893c09b28cbb110bbb3a411ce434fdc338e1e2", "raw_outputs": ["runs/ablation-season-index-seed3/metrics.json", "runs/ablation-season-index-seed3/stdout.txt", "runs/ablation-season-index-seed3/stderr.txt"], "reason": "improved primary metric", "run_id": "ablation-season-index-seed3", "status": "ok", "trial_id": "ablation-season-index-seed3"}
{"code_sha256": "a8054ee557567eec47692f11b900eec6c153295f97cd6a5462458d01d4157d8c", "config_sha256": "e97cf7d786088b2dd50df8283bf43d55deb55150edb028dc3f7e7fcb3fff283b", "decision": "discard", "description": "Add all three workload-specific indexes.", "environment": "Python 3.12.12 on macOS-15.7.4-arm64-arm-64bit", "evaluator_immutable": true, "experiment_spec_sha256": "284f2178f4fc5613e248b18006add3f06b0c242c14ddd93db9e398f147cff425", "metric": 35.3873705, "metric_definition": "primary_metric (minimize)", "metrics_path": "runs/ablation-composite-index-seed4/metrics.json", "protocol_fingerprint": "433b63f8c55c6e043dfe49f12d893c09b28cbb110bbb3a411ce434fdc338e1e2", "raw_outputs": ["runs/ablation-composite-index-seed4/metrics.json", "runs/ablation-composite-index-seed4/stdout.txt", "runs/ablation-composite-index-seed4/stderr.txt"], "reason": "did not improve primary metric", "run_id": "ablation-composite-index-seed4", "status": "ok", "trial_id": "ablation-composite-index-seed4"}
